{
  "candidate_id": "candidate-0e34d891d25d23bb092249d64341f8a5b7cad7de95c3d4ba7f13f118ab91a7f8",
  "capability_id": "distribution-admission",
  "catalog_hash": "sha256:1bc2c22639e5e1e22920673bb5f4423b59bda6ab05732cb3c1300499db7b6693",
  "duplicate_test_count": 0,
  "executed_test_count": 1,
  "expected_test_count": 1,
  "failed_test_count": 1,
  "missing_test_count": 0,
  "qualification_policy": {
    "digest": "sha256:4bb55d54f1737c289bb91a5823f4315ff163e81bb3101353413fdff439fa0927",
    "logical_name": "qualification-oracle-policy-v1",
    "media_type": "application/json",
    "relative_path": "pmorg/capabilities/qualification-oracle-policy-v1.json",
    "size_bytes": 32871
  },
  "required_test_manifest": {
    "digest": "sha256:339e267d822263efb21e59bccf32ffbefee78941713afc5f9b13558c66a92510",
    "logical_name": "distribution-admission-contract-tests",
    "media_type": "application/json",
    "relative_path": "pmorg/capabilities/contract-tests/distribution-admission.json",
    "size_bytes": 202
  },
  "schema_version": "pmorg.candidate-qualification-report/v1",
  "source_ref": {
    "commit": "1da679cefc96165c6b9b64c3bc769584b88f88c2",
    "paths": [
      "mobile/src/api/__tests__/query-keys.test.ts",
      "mobile/src/api/auth/__tests__/browserSso.test.ts",
      "mobile/src/api/auth/__tests__/providers.test.ts",
      "mobile/src/api/auth/__tests__/sessionManager.test.ts",
      "mobile/src/api/auth/__tests__/tokenStore.test.ts",
      "mobile/src/api/auth/browserSso.ts",
      "mobile/src/api/auth/instanceUrl.ts",
      "mobile/src/api/auth/providers.ts",
      "mobile/src/api/auth/sessionManager.ts",
      "mobile/src/api/auth/tokenStore.ts",
      "mobile/src/api/auth/useAuthConfig.ts",
      "mobile/src/api/auth/useBrowserLogin.ts",
      "mobile/src/api/auth/useEmailLogin.ts",
      "mobile/src/api/auth/useEmailSignup.ts",
      "mobile/src/api/auth/useLogout.ts",
      "mobile/src/api/auth/useSessionRefresh.ts",
      "mobile/src/api/chat/__tests__/sessions.test.tsx",
      "mobile/src/api/chat/sessions.ts",
      "mobile/src/api/client.ts",
      "mobile/src/api/config.ts",
      "mobile/src/api/errors.ts",
      "mobile/src/api/query-keys.ts",
      "mobile/src/api/types.ts",
      "mobile/src/app/(app)/_layout.tsx",
      "mobile/src/app/(app)/chat/[id].tsx",
      "mobile/src/app/(app)/index.tsx",
      "mobile/src/app/(auth)/_layout.tsx",
      "mobile/src/app/(auth)/connect.tsx",
      "mobile/src/app/(auth)/login.tsx",
      "mobile/src/app/(auth)/signup.tsx",
      "mobile/src/app/_layout.tsx",
      "mobile/src/chat/__tests__/chatHistory.test.ts",
      "mobile/src/chat/__tests__/messageTree.test.ts",
      "mobile/src/chat/__tests__/ndjson.test.ts",
      "mobile/src/chat/chatHistory.ts",
      "mobile/src/chat/interfaces.ts",
      "mobile/src/chat/messageTree.ts",
      "mobile/src/chat/ndjson.ts",
      "mobile/src/chat/streamingModels.ts",
      "mobile/src/components/auth/AuthGate.tsx",
      "mobile/src/components/auth/AuthMethods.tsx",
      "mobile/src/components/auth/AuthScreenShell.tsx",
      "mobile/src/components/auth/AuthSwitchLink.tsx",
      "mobile/src/components/auth/AuthUnreachable.tsx",
      "mobile/src/components/auth/EmailPasswordForm.tsx",
      "mobile/src/components/auth/ProviderSsoButton.tsx",
      "mobile/src/components/auth/__tests__/authRoute.test.ts",
      "mobile/src/components/auth/authRoute.ts",
      "mobile/src/components/chat/AppSidebar.tsx",
      "mobile/src/components/chat/ChatHeader.tsx",
      "mobile/src/components/chat/ChatScreen.tsx",
      "mobile/src/components/chat/ChatSessionList.tsx",
      "mobile/src/components/chat/InputBar.tsx",
      "mobile/src/components/chat/WelcomeMessage.tsx",
      "mobile/src/components/chat/__tests__/ChatSessionList.test.tsx",
      "mobile/src/components/form/__tests__/fields.test.tsx",
      "mobile/src/components/form/__tests__/input-layouts.test.tsx",
      "mobile/src/components/form/fields.tsx",
      "mobile/src/components/form/index.ts",
      "mobile/src/components/form/input-layouts.tsx",
      "mobile/src/components/form/use-field-controller.ts",
      "mobile/src/components/sidebar/Sidebar.tsx",
      "mobile/src/components/sidebar/SidebarProvider.tsx",
      "mobile/src/components/sidebar/SidebarTab.tsx",
      "mobile/src/components/sidebar/index.ts",
      "mobile/src/components/sidebar/interfaces.ts",
      "mobile/src/components/ui/button.styles.ts",
      "mobile/src/components/ui/button.tsx",
      "mobile/src/components/ui/icon.tsx",
      "mobile/src/components/ui/separator.tsx",
      "mobile/src/components/ui/text-input.tsx",
      "mobile/src/components/ui/text.tsx",
      "mobile/src/global.css",
      "mobile/src/hooks/useCurrentUser.ts",
      "mobile/src/icons/alert-circle.tsx",
      "mobile/src/icons/arrow-right-circle.tsx",
      "mobile/src/icons/bubble-text.tsx",
      "mobile/src/icons/eye-closed.tsx",
      "mobile/src/icons/eye.tsx",
      "mobile/src/icons/folder.tsx",
      "mobile/src/icons/google.tsx",
      "mobile/src/icons/onyx-logo.tsx",
      "mobile/src/icons/plus.tsx",
      "mobile/src/icons/search.tsx",
      "mobile/src/icons/settings.tsx",
      "mobile/src/icons/sidebar.tsx",
      "mobile/src/icons/types.ts",
      "mobile/src/icons/x-octagon.tsx",
      "mobile/src/icons/x.tsx",
      "mobile/src/lib/greetings.ts",
      "mobile/src/lib/utils.ts",
      "mobile/src/query/__tests__/client.test.ts",
      "mobile/src/query/client.ts",
      "mobile/src/query/focus.ts",
      "mobile/src/query/online.ts",
      "mobile/src/state/session.ts",
      "mobile/src/state/storage.ts"
    ],
    "repository": "https://github.com/onyx-dot-app/onyx.git",
    "source_snapshot": {
      "digest": "sha256:6ebe198463d6c461e2ab3d6dc68d40152f73b79adf91c64213c274bec9b2f75a",
      "logical_name": "onyx_ce-path-inventory",
      "media_type": "application/json",
      "relative_path": "pmorg/capabilities/source-scopes/onyx-ce-path-inventory-v1.json",
      "size_bytes": 1382014
    },
    "tree_hash": "sha256:6ebe198463d6c461e2ab3d6dc68d40152f73b79adf91c64213c274bec9b2f75a"
  },
  "test_evidence": [
    {
      "result": {
        "digest": "sha256:5bc8660954bf29c7f5536d12b7de3af4cfb12de8958c9bff3a29799ef0a9f6d6",
        "logical_name": "candidate-0e34d891d25d23bb092249d64341f8a5b7cad7de95c3d4ba7f13f118ab91a7f8-qualification-oracle-result",
        "media_type": "application/json",
        "relative_path": "pmorg/capabilities/candidate-qualification-results/distribution-admission/candidate-0e34d891d25d23bb092249d64341f8a5b7cad7de95c3d4ba7f13f118ab91a7f8.json",
        "size_bytes": 2671
      },
      "test_id": "A-LIC-003",
      "test_manifest": {
        "digest": "sha256:3c2a66f92e9f6bb5e5d34cb27da2ddff59b114e7efbdf09612e16f74bf0755ad",
        "logical_name": "distribution-admission-A-LIC-003-qualification-test-vector",
        "media_type": "application/json",
        "relative_path": "pmorg/capabilities/qualification-test-vectors/distribution-admission-A-LIC-003-v1.json",
        "size_bytes": 4080
      },
      "verdict": "fail"
    }
  ],
  "verdict": "fail"
}
