{
  "candidate_id": "candidate-e869089d2db662369e8983c22008ad92a0b7e7817dbb4ce16fbd7d8c2ac7330f",
  "capability_id": "governed-onyx-fork",
  "catalog_hash": "sha256:1bc2c22639e5e1e22920673bb5f4423b59bda6ab05732cb3c1300499db7b6693",
  "duplicate_test_count": 0,
  "executed_test_count": 3,
  "expected_test_count": 3,
  "failed_test_count": 3,
  "missing_test_count": 0,
  "qualification_policy": {
    "digest": "sha256:72af0da056d2b026de1e3366f654d7ece8831d474a03155ddb011ce8525c9b7d",
    "logical_name": "qualification-oracle-extension-governed-fork-v1",
    "media_type": "application/json",
    "relative_path": "pmorg/capabilities/qualification-oracle-extension-governed-fork-v1.json",
    "size_bytes": 7357
  },
  "required_test_manifest": {
    "digest": "sha256:a9d0a22d7b15ef8af11e2c82a89b20246a2ff9f8ad79ea9c0dac73f7e8e84ded",
    "logical_name": "governed-onyx-fork-contract-tests",
    "media_type": "application/json",
    "relative_path": "pmorg/capabilities/contract-tests/governed-onyx-fork.json",
    "size_bytes": 286
  },
  "schema_version": "pmorg.candidate-qualification-report/v1",
  "source_ref": {
    "commit": "1da679cefc96165c6b9b64c3bc769584b88f88c2",
    "paths": [
      "backend/onyx/llm/__init__.py",
      "backend/onyx/llm/constants.py",
      "backend/onyx/llm/cost.py",
      "backend/onyx/llm/factory.py",
      "backend/onyx/llm/interfaces.py",
      "backend/onyx/llm/litellm_singleton/__init__.py",
      "backend/onyx/llm/litellm_singleton/config.py",
      "backend/onyx/llm/litellm_singleton/monkey_patches.py",
      "backend/onyx/llm/model_metadata_enrichments.json",
      "backend/onyx/llm/model_name_parser.py",
      "backend/onyx/llm/model_response.py",
      "backend/onyx/llm/models.py",
      "backend/onyx/llm/multi_llm.py",
      "backend/onyx/llm/override_models.py",
      "backend/onyx/llm/prompt_cache/README.md",
      "backend/onyx/llm/prompt_cache/__init__.py",
      "backend/onyx/llm/prompt_cache/cache_manager.py",
      "backend/onyx/llm/prompt_cache/models.py",
      "backend/onyx/llm/prompt_cache/processor.py",
      "backend/onyx/llm/prompt_cache/providers/__init__.py",
      "backend/onyx/llm/prompt_cache/providers/anthropic.py",
      "backend/onyx/llm/prompt_cache/providers/base.py",
      "backend/onyx/llm/prompt_cache/providers/factory.py",
      "backend/onyx/llm/prompt_cache/providers/noop.py",
      "backend/onyx/llm/prompt_cache/providers/openai.py",
      "backend/onyx/llm/prompt_cache/providers/vertex.py",
      "backend/onyx/llm/prompt_cache/utils.py",
      "backend/onyx/llm/request_context.py",
      "backend/onyx/llm/tracing_wrap.py",
      "backend/onyx/llm/utils.py",
      "backend/onyx/llm/well_known_providers/auto_update_models.py",
      "backend/onyx/llm/well_known_providers/auto_update_service.py",
      "backend/onyx/llm/well_known_providers/constants.py",
      "backend/onyx/llm/well_known_providers/llm_provider_options.py",
      "backend/onyx/llm/well_known_providers/models.py",
      "backend/onyx/llm/well_known_providers/recommended-models.json"
    ],
    "repository": "https://github.com/onyx-dot-app/onyx.git",
    "source_snapshot": {
      "digest": "sha256:6ebe198463d6c461e2ab3d6dc68d40152f73b79adf91c64213c274bec9b2f75a",
      "logical_name": "onyx_ce-path-inventory",
      "media_type": "application/json",
      "relative_path": "pmorg/capabilities/source-scopes/onyx-ce-path-inventory-v1.json",
      "size_bytes": 1382014
    },
    "tree_hash": "sha256:6ebe198463d6c461e2ab3d6dc68d40152f73b79adf91c64213c274bec9b2f75a"
  },
  "test_evidence": [
    {
      "result": {
        "digest": "sha256:1996ae9dc810b4a15cc5d702d469c23763ff2ee76b33fbb9e7106687c2258a0a",
        "logical_name": "candidate-e869089d2db662369e8983c22008ad92a0b7e7817dbb4ce16fbd7d8c2ac7330f-A-FORK-001-governed-fork-oracle-result",
        "media_type": "application/json",
        "relative_path": "pmorg/capabilities/governed-fork-candidate-qualification-results/candidate-e869089d2db662369e8983c22008ad92a0b7e7817dbb4ce16fbd7d8c2ac7330f/A-FORK-001.json",
        "size_bytes": 3757
      },
      "test_id": "A-FORK-001",
      "test_manifest": {
        "digest": "sha256:2652874b3a4f554100ca8172dc16acec2e46bb7eb51d40b8ba27fe433bde24e6",
        "logical_name": "governed-onyx-fork-A-FORK-001-qualification-test-vector",
        "media_type": "application/json",
        "relative_path": "pmorg/capabilities/qualification-test-vector-extensions/governed-onyx-fork-A-FORK-001-v1.json",
        "size_bytes": 3949
      },
      "verdict": "fail"
    },
    {
      "result": {
        "digest": "sha256:71eae091fe01e12aa6d7fe7eeb827fe9d3b42e580ff20e1bd8d2c883eb7a2439",
        "logical_name": "candidate-e869089d2db662369e8983c22008ad92a0b7e7817dbb4ce16fbd7d8c2ac7330f-A-SURFACE-001-governed-fork-oracle-result",
        "media_type": "application/json",
        "relative_path": "pmorg/capabilities/governed-fork-candidate-qualification-results/candidate-e869089d2db662369e8983c22008ad92a0b7e7817dbb4ce16fbd7d8c2ac7330f/A-SURFACE-001.json",
        "size_bytes": 3766
      },
      "test_id": "A-SURFACE-001",
      "test_manifest": {
        "digest": "sha256:63da799801efe4719938c0220f7c4c77b8e74b138cb0a5b276ee99d88c567522",
        "logical_name": "governed-onyx-fork-A-SURFACE-001-qualification-test-vector",
        "media_type": "application/json",
        "relative_path": "pmorg/capabilities/qualification-test-vector-extensions/governed-onyx-fork-A-SURFACE-001-v1.json",
        "size_bytes": 3941
      },
      "verdict": "fail"
    },
    {
      "result": {
        "digest": "sha256:3ec02af58a485093b06e754463133776d71c699b87ca3c7da00bf20817771b93",
        "logical_name": "candidate-e869089d2db662369e8983c22008ad92a0b7e7817dbb4ce16fbd7d8c2ac7330f-A-UPSTREAM-001-governed-fork-oracle-result",
        "media_type": "application/json",
        "relative_path": "pmorg/capabilities/governed-fork-candidate-qualification-results/candidate-e869089d2db662369e8983c22008ad92a0b7e7817dbb4ce16fbd7d8c2ac7330f/A-UPSTREAM-001.json",
        "size_bytes": 3769
      },
      "test_id": "A-UPSTREAM-001",
      "test_manifest": {
        "digest": "sha256:e608f247573498b8fb110455f13adf670376f7e18c1c560c1a690389f01eb963",
        "logical_name": "governed-onyx-fork-A-UPSTREAM-001-qualification-test-vector",
        "media_type": "application/json",
        "relative_path": "pmorg/capabilities/qualification-test-vector-extensions/governed-onyx-fork-A-UPSTREAM-001-v1.json",
        "size_bytes": 3946
      },
      "verdict": "fail"
    }
  ],
  "verdict": "fail"
}
