{
  "candidate_id": "candidate-9d25cae66af9d25f1af1d9fd78b343316aa6e48cfabadbe4cb04e261e7314b10",
  "capability_id": "thin-fork-boundary",
  "catalog_hash": "sha256:1bc2c22639e5e1e22920673bb5f4423b59bda6ab05732cb3c1300499db7b6693",
  "duplicate_test_count": 0,
  "executed_test_count": 1,
  "expected_test_count": 1,
  "failed_test_count": 1,
  "missing_test_count": 0,
  "qualification_policy": {
    "digest": "sha256:ce1e1127a8b743555978936f6ca431a1e5afd873fc6cdeece81d4be43e30da46",
    "logical_name": "qualification-oracle-extension-thin-fork-v1",
    "media_type": "application/json",
    "relative_path": "pmorg/capabilities/qualification-oracle-extension-thin-fork-v1.json",
    "size_bytes": 4717
  },
  "required_test_manifest": {
    "digest": "sha256:10866f7bfec7f0ebdd46590079604c757354aedea32d674914936bb98f72dc7f",
    "logical_name": "thin-fork-boundary-contract-tests",
    "media_type": "application/json",
    "relative_path": "pmorg/capabilities/contract-tests/thin-fork-boundary.json",
    "size_bytes": 202
  },
  "schema_version": "pmorg.candidate-qualification-report/v1",
  "source_ref": {
    "commit": "1da679cefc96165c6b9b64c3bc769584b88f88c2",
    "paths": [
      "web/src/hooks/__tests__/useDraft.test.tsx",
      "web/src/hooks/__tests__/useShowOnboarding.test.tsx",
      "web/src/hooks/appNavigation.ts",
      "web/src/hooks/formHooks.ts",
      "web/src/hooks/useAdminSkills.ts",
      "web/src/hooks/useAdminUsers.ts",
      "web/src/hooks/useAppFocus.ts",
      "web/src/hooks/useAuthTypeMetadata.ts",
      "web/src/hooks/useAvailableTools.ts",
      "web/src/hooks/useBillingInformation.ts",
      "web/src/hooks/useBoundingBox.ts",
      "web/src/hooks/useBrowserInfo.ts",
      "web/src/hooks/useCCPairs.ts",
      "web/src/hooks/useChatController.ts",
      "web/src/hooks/useChatSessionController.ts",
      "web/src/hooks/useChatSessions.ts",
      "web/src/hooks/useClickOutside.ts",
      "web/src/hooks/useCloudSubscription.ts",
      "web/src/hooks/useCodeInterpreter.ts",
      "web/src/hooks/useContainerCenter.ts",
      "web/src/hooks/useContentEditable.ts",
      "web/src/hooks/useContentSize.ts",
      "web/src/hooks/useCurrentUser.ts",
      "web/src/hooks/useDeepResearchToggle.ts",
      "web/src/hooks/useDraft.ts",
      "web/src/hooks/useEscapeInterrupt.test.tsx",
      "web/src/hooks/useEscapeInterrupt.ts",
      "web/src/hooks/useFederatedOAuthStatus.ts",
      "web/src/hooks/useFeedbackController.ts",
      "web/src/hooks/useFilter.ts",
      "web/src/hooks/useGroups.ts",
      "web/src/hooks/useHighlightLanguages.ts",
      "web/src/hooks/useImageDropzone.ts",
      "web/src/hooks/useIndexAttemptStageMetrics.ts",
      "web/src/hooks/useIsTrialingEnterprise.ts",
      "web/src/hooks/useKeyPress.ts",
      "web/src/hooks/useLicense.ts",
      "web/src/hooks/useMcpServers.ts",
      "web/src/hooks/useMemoryManager.ts",
      "web/src/hooks/useMultiModelChat.ts",
      "web/src/hooks/useNotifications.ts",
      "web/src/hooks/useOnMount.ts",
      "web/src/hooks/useOpenApiTools.ts",
      "web/src/hooks/usePaginatedFetch.ts",
      "web/src/hooks/usePromptShortcuts.ts",
      "web/src/hooks/useQueuedMessageNavigation.ts",
      "web/src/hooks/useScimToken.ts",
      "web/src/hooks/useScreenSize.ts",
      "web/src/hooks/useSearchSettings.test.ts",
      "web/src/hooks/useServerTools.ts",
      "web/src/hooks/useShareableGroups.ts",
      "web/src/hooks/useShareableUsers.ts",
      "web/src/hooks/useShowOnboarding.ts",
      "web/src/hooks/useSlashPicker.ts",
      "web/src/hooks/useSmoothStreaming.ts",
      "web/src/hooks/useTags.ts",
      "web/src/hooks/useTierAtLeast.ts",
      "web/src/hooks/useToast.ts",
      "web/src/hooks/useTokenRefresh.test.tsx",
      "web/src/hooks/useTokenRefresh.ts",
      "web/src/hooks/useTypewriter.ts",
      "web/src/hooks/useUserCounts.ts",
      "web/src/hooks/useUserExternalApps.ts",
      "web/src/hooks/useUserPersonalization.ts",
      "web/src/hooks/useUserSkills.ts",
      "web/src/hooks/useUsers.ts",
      "web/src/hooks/useVisibilityGatedInterval.test.tsx",
      "web/src/hooks/useVisibilityGatedInterval.ts",
      "web/src/hooks/useVoicePlayback.ts",
      "web/src/hooks/useVoiceRecorder.ts",
      "web/src/hooks/useVoiceStatus.ts",
      "web/src/hooks/useWebSocket.ts"
    ],
    "repository": "https://github.com/onyx-dot-app/onyx.git",
    "source_snapshot": {
      "digest": "sha256:6ebe198463d6c461e2ab3d6dc68d40152f73b79adf91c64213c274bec9b2f75a",
      "logical_name": "onyx_ce-path-inventory",
      "media_type": "application/json",
      "relative_path": "pmorg/capabilities/source-scopes/onyx-ce-path-inventory-v1.json",
      "size_bytes": 1382014
    },
    "tree_hash": "sha256:6ebe198463d6c461e2ab3d6dc68d40152f73b79adf91c64213c274bec9b2f75a"
  },
  "test_evidence": [
    {
      "result": {
        "digest": "sha256:16c41f2da573d945953a02e1c9f159b3c16fc5145abb6b3ea5ca6ee7962fa5ad",
        "logical_name": "candidate-9d25cae66af9d25f1af1d9fd78b343316aa6e48cfabadbe4cb04e261e7314b10-thin-fork-oracle-result",
        "media_type": "application/json",
        "relative_path": "pmorg/capabilities/thin-fork-candidate-qualification-results/candidate-9d25cae66af9d25f1af1d9fd78b343316aa6e48cfabadbe4cb04e261e7314b10.json",
        "size_bytes": 3288
      },
      "test_id": "A-PATCH-001",
      "test_manifest": {
        "digest": "sha256:257326b0e311d1cf166bfa8ea8a5e5b139a7efe370cbdbad5eecd49b37ca4c31",
        "logical_name": "thin-fork-boundary-A-PATCH-001-qualification-test-vector",
        "media_type": "application/json",
        "relative_path": "pmorg/capabilities/qualification-test-vector-extensions/thin-fork-boundary-A-PATCH-001-v1.json",
        "size_bytes": 4272
      },
      "verdict": "fail"
    }
  ],
  "verdict": "fail"
}
